{
  "schema_version": 1,
  "benchmark_version": "0.1.0-pilot",
  "run_id": "mono-winter-t1-delete-item-sonnet-claude-r1",
  "created_at": "2026-07-04T16:07:52.206160+00:00",
  "cell": {
    "topology": "mono",
    "condition": "winter",
    "prompt": "t1-delete-item",
    "model": "sonnet",
    "host": "claude",
    "host_version": "2.1.201 (Claude Code)",
    "repetition": 1
  },
  "pins": {
    "mono_sha": "e7249413eee9b9c6e6cb5ce90cf5280dfc57e20d"
  },
  "result_class": "fully_achieved_unattended",
  "intervention": {
    "engineering_intervention": false,
    "events": []
  },
  "stall": {
    "detected": false,
    "signal": "none"
  },
  "checks": [
    {
      "id": "reg.api-boots-health-ok",
      "layer": "regression",
      "required": true,
      "status": "pass",
      "detail": ""
    },
    {
      "id": "reg.worker-writes-rows",
      "layer": "regression",
      "required": true,
      "status": "pass",
      "detail": ""
    },
    {
      "id": "reg.web-typecheck-build",
      "layer": "regression",
      "required": true,
      "status": "pass",
      "detail": "\n> winter-test-service-web@0.0.1 build\n> tsc && vite build\n\nvite v6.4.3 building for production...\ntransforming...\n\u2713 29 modules transformed.\nrendering chunks...\ncomputing gzip size...\ndist/index.html                   0.40 kB \u2502 gzip:  0.27 kB\ndist/assets/index-DzA66tKi.css    0.11 kB \u2502 gzip:  0.12 kB\ndist/assets/index-B8M5wSil.js   200.62 kB \u2502 gzip: 62.89 kB\n\u2713 built in 586ms\n"
    },
    {
      "id": "del.committed-feature-branch",
      "layer": "delivery",
      "required": true,
      "status": "pass",
      "detail": "cohesion=1.0"
    },
    {
      "id": "del.diff-non-empty",
      "layer": "delivery",
      "required": true,
      "status": "pass",
      "detail": ""
    },
    {
      "id": "reg.items-create-list",
      "layer": "regression",
      "required": true,
      "status": "pass",
      "detail": ""
    },
    {
      "id": "reg.ui-lists-items",
      "layer": "regression",
      "required": true,
      "status": "pass",
      "detail": ""
    },
    {
      "id": "reg.api-health",
      "layer": "regression",
      "required": true,
      "status": "pass",
      "detail": ""
    },
    {
      "id": "t1.api.delete-204-removes",
      "layer": "api",
      "required": true,
      "status": "pass",
      "detail": ""
    },
    {
      "id": "t1.api.delete-missing-404",
      "layer": "api",
      "required": true,
      "status": "pass",
      "detail": ""
    },
    {
      "id": "t1.db.only-target-removed",
      "layer": "db",
      "required": true,
      "status": "pass",
      "detail": ""
    },
    {
      "id": "t1.ui.row-delete-no-reload",
      "layer": "ui",
      "required": true,
      "status": "pass",
      "detail": ""
    },
    {
      "id": "t1.structural.seam",
      "layer": "structural",
      "required": true,
      "status": "pass",
      "detail": "no SQL added outside the persistence layer"
    }
  ],
  "evidence": {
    "app_launched": true,
    "db_user_rows": 0,
    "db_worker_rows": 79,
    "broker_deliveries": 80,
    "capability_matrix_present": true,
    "capability_matrix_coverage": 1.0
  },
  "delivery": {
    "committed": true,
    "branch_cohesion": 1.0,
    "repos": [
      {
        "repo": "winter-test-service",
        "touched": true,
        "branch": "alpha",
        "default_branch": "master",
        "commits": [
          {
            "sha": "ed5206ebeb854dab26f4979301d0021f1bdb647d",
            "message": "feat(winter-test-service): support deleting items\n\nAdds DELETE /api/items/{id} through the repository seam (WriteItemRepository.delete_item),\na service-layer ItemNotFoundError mapped to 404, and a per-row delete control in the web UI\nthat removes the row from state without a full page reload.\n\nCo-Authored-By: Claude Sonnet 5 <noreply@anthropic.com>"
          }
        ],
        "diff_stat": "6 files changed, 74 insertions(+), 1 deletion(-)"
      }
    ]
  },
  "judge": {
    "model": "claude-haiku-4-5-20251001",
    "config_id": "judge-v1",
    "blind_id": "submission-45343119",
    "dimensions": [
      {
        "id": "requirement_completeness",
        "score": "met",
        "evidence": "All four requirements verified via passing executable checks with 100% capability matrix coverage: (1) DELETE /api/items/{id} returns 204 on success and 404 if missing \u2014 t1.api.delete-204-removes and t1.api.delete-missing-404 pass; (2) deletion through repository seam with no SQL outside \u2014 t1.structural.seam passes with detail 'no SQL added outside the persistence layer'; (3) web UI delete control per row, no page reload \u2014 t1.ui.row-delete-no-reload passes; (4) existing behavior preserved \u2014 all regression checks pass (reg.api-boots-health-ok, reg.items-create-list, reg.ui-lists-items, reg.api-health). Runtime evidence confirms app_launched: true and capability_matrix_coverage: 1.0."
      },
      {
        "id": "coherence_maintainability",
        "score": "met",
        "evidence": "Implementation integrates seamlessly with existing architecture: API endpoint (main.py:105-110) follows same pattern as create_item with proper exception mapping; service layer (item_service.py:28-30) matches add_item pattern; repository interface and implementation (item_repository.py) uses established session management and error wrapping consistent with add_item; web UI (App.tsx) mirrors existing state management patterns (deletingId/deleteError like adding/crashPending) and integrates delete button into existing table without layout disruption. No duplication, no leaky abstractions."
      },
      {
        "id": "refactor_authenticity",
        "score": "not_applicable",
        "evidence": "Task is feature addition (delete functionality), not structural refactoring. No reorganization or seam changes requested."
      },
      {
        "id": "cross_boundary_consistency",
        "score": "met",
        "evidence": "Contracts consistent across all boundaries: API endpoint (DELETE /api/items/{id}) returns standard REST codes (204 success, 404 not found); service\u2192repository contract (delete_item returns bool, service translates to ItemNotFoundError exception) is clean and unambiguous; repository\u2192database uses proper session management and SQLAlchemy patterns; web\u2192API interaction (sends DELETE, handles 204 and 404, updates state) matches endpoint contract. No type or schema mismatches."
      },
      {
        "id": "material_defects",
        "score": "met",
        "evidence": "Repository implementation (item_repository.py:75-86): proper session context, null check, SQLAlchemy error wrapping. Service wrapper (item_service.py:28-30): correct error raising on false return. API handler (main.py:105-110): correct exception mapping to 404. Web delete handler (App.tsx:116-132): handles 204 success and 404 not-found correctly, filters items optimistically on both (reasonable UX since 404 means item is gone), maintains loading state, shows network errors. All implementations match test evidence of passing checks."
      },
      {
        "id": "scope_violations",
        "score": "met",
        "evidence": "All regression tests pass (reg.api-boots-health-ok, reg.worker-writes-rows, reg.items-create-list, reg.ui-lists-items, reg.api-health, reg.web-typecheck-build). No tests disabled or weakened. No executable checks bypassed. No attempts to game evaluation. Commit message is clear, scoped, and explains architectural decisions. Branch cohesion 1.0 across single repository."
      },
      {
        "id": "delivery_quality",
        "score": "met",
        "evidence": "Commit message follows conventional commits (feat prefix), clearly describes what (DELETE endpoint, error mapping, UI button) and how (repository seam, state filtering). Branch name 'alpha' is sensible. Metadata shows branch_cohesion: 1.0. Author demonstrated execution: app_launched: true, provided full capability_matrix with coverage: 1.0, reporting verification method and result for every requirement (all 5 api/db/ui/structural checks documented in runtime evidence signals)."
      }
    ],
    "material_unmet": false,
    "proposed_class": "fully_achieved_unattended",
    "adjudication": {
      "routed": false,
      "reason": "",
      "resolved_by": null
    }
  },
  "efficiency": {
    "recorded_not_scored": true,
    "wall_clock_seconds": 283.1,
    "tokens_input": 38,
    "tokens_output": 7185,
    "cost_usd": 1.79107245,
    "commands_executed": 62,
    "failed_commands": 3,
    "retries": null
  },
  "artifacts": {
    "transcript": "transcript.jsonl",
    "final_message": "final-message.md",
    "capability_matrix": "capability-matrix.md",
    "delivery": "delivery.json",
    "diff": "diff/",
    "db_snapshot": "db/",
    "broker_stats": "broker/stats.json"
  }
}
