{
  "schema_version": 1,
  "benchmark_version": "0.1.0-pilot",
  "run_id": "mono-plain-t1-delete-item-sonnet-claude-r1",
  "created_at": "2026-07-04T16:14:37.411620+00:00",
  "cell": {
    "topology": "mono",
    "condition": "plain",
    "prompt": "t1-delete-item",
    "model": "sonnet",
    "host": "claude",
    "host_version": "2.1.201 (Claude Code)",
    "repetition": 1
  },
  "pins": {
    "mono_sha": "e7249413eee9b9c6e6cb5ce90cf5280dfc57e20d"
  },
  "result_class": "fully_achieved_unattended",
  "intervention": {
    "engineering_intervention": false,
    "events": []
  },
  "stall": {
    "detected": false,
    "signal": "none"
  },
  "checks": [
    {
      "id": "reg.api-boots-health-ok",
      "layer": "regression",
      "required": true,
      "status": "pass",
      "detail": ""
    },
    {
      "id": "reg.worker-writes-rows",
      "layer": "regression",
      "required": true,
      "status": "pass",
      "detail": ""
    },
    {
      "id": "reg.web-typecheck-build",
      "layer": "regression",
      "required": true,
      "status": "pass",
      "detail": "\n> winter-test-service-web@0.0.1 build\n> tsc && vite build\n\nvite v6.4.3 building for production...\ntransforming...\n\u2713 29 modules transformed.\nrendering chunks...\ncomputing gzip size...\ndist/index.html                   0.40 kB \u2502 gzip:  0.27 kB\ndist/assets/index-DzA66tKi.css    0.11 kB \u2502 gzip:  0.12 kB\ndist/assets/index-C2mnKEYX.js   200.62 kB \u2502 gzip: 62.89 kB\n\u2713 built in 604ms\n"
    },
    {
      "id": "del.committed-feature-branch",
      "layer": "delivery",
      "required": true,
      "status": "pass",
      "detail": "cohesion=1.0"
    },
    {
      "id": "del.diff-non-empty",
      "layer": "delivery",
      "required": true,
      "status": "pass",
      "detail": ""
    },
    {
      "id": "reg.items-create-list",
      "layer": "regression",
      "required": true,
      "status": "pass",
      "detail": ""
    },
    {
      "id": "reg.ui-lists-items",
      "layer": "regression",
      "required": true,
      "status": "pass",
      "detail": ""
    },
    {
      "id": "reg.api-health",
      "layer": "regression",
      "required": true,
      "status": "pass",
      "detail": ""
    },
    {
      "id": "t1.api.delete-204-removes",
      "layer": "api",
      "required": true,
      "status": "pass",
      "detail": ""
    },
    {
      "id": "t1.api.delete-missing-404",
      "layer": "api",
      "required": true,
      "status": "pass",
      "detail": ""
    },
    {
      "id": "t1.db.only-target-removed",
      "layer": "db",
      "required": true,
      "status": "pass",
      "detail": ""
    },
    {
      "id": "t1.ui.row-delete-no-reload",
      "layer": "ui",
      "required": true,
      "status": "pass",
      "detail": ""
    },
    {
      "id": "t1.structural.seam",
      "layer": "structural",
      "required": true,
      "status": "pass",
      "detail": "no SQL added outside the persistence layer"
    }
  ],
  "evidence": {
    "app_launched": true,
    "db_user_rows": 0,
    "db_worker_rows": 0,
    "broker_deliveries": 0,
    "capability_matrix_present": true,
    "capability_matrix_coverage": 1.0
  },
  "delivery": {
    "committed": true,
    "branch_cohesion": 1.0,
    "repos": [
      {
        "repo": "winter-test-service",
        "touched": true,
        "branch": "feature/delete-items",
        "default_branch": "master",
        "commits": [
          {
            "sha": "ea8fff81c008fadd7583ae480df7b4cd2e4b0a8a",
            "message": "feat(winter-test-service): support deleting items\n\nAdds DELETE /api/items/{id} through the same repository seam as the\nexisting item operations (service -> IWriteItemRepository -> SQLAlchemy\nadapter, no raw SQL outside the persistence layer). Returns 204 on\nsuccess and 404 when the id doesn't exist.\n\nThe web UI gets a per-row delete control that removes the row from\nlocal state on success, so the list updates without a page reload."
          }
        ],
        "diff_stat": "5 files changed, 65 insertions(+), 1 deletion(-)"
      }
    ]
  },
  "judge": {
    "model": "claude-haiku-4-5-20251001",
    "config_id": "judge-v1",
    "blind_id": "submission-1b2325bc",
    "dimensions": [
      {
        "id": "requirement_completeness",
        "score": "met",
        "evidence": "All four requirements satisfied: (1) DELETE /api/items/{id} endpoint with 204/404 responses verified by executable checks t1.api.delete-204-removes, t1.api.delete-missing-404; (2) repository seam layering verified by t1.structural.seam (detail: 'no SQL added outside the persistence layer') and code shows service\u2192repository delegation pattern; (3) web UI delete control without reload verified by t1.ui.row-delete-no-reload; (4) existing behavior preserved verified by all regression checks (reg.api-boots-health-ok, reg.items-create-list, reg.ui-lists-items, reg.api-health, etc.). Runtime evidence signals show capability_matrix_present=true with coverage=1.0, confirming author provided required per-requirement verification report."
      },
      {
        "id": "coherence_maintainability",
        "score": "met",
        "evidence": "Implementation follows established patterns: API endpoint delegates to service layer (api/app/main.py:delete_item); service delegates to repository (api/app/services/item_service.py); protocol interface extended (wts_persistence/repositories/item_repository.py); SQLAlchemy ORM with session management in implementation (wts_persistence/internal/item_repository.py:76-85). No raw SQL outside persistence layer. Web UI uses identical fetch pattern and state management (useState hooks) as create_item flow (web/src/App.tsx:handleDelete). Delete button styling (red border, transparent background) consistent with existing UI aesthetic. No duplication, no bolted-on abstractions."
      },
      {
        "id": "refactor_authenticity",
        "score": "not_applicable",
        "evidence": "Task requested a feature addition (new delete capability), not a structural refactoring."
      },
      {
        "id": "cross_boundary_consistency",
        "score": "met",
        "evidence": "API contract: 204 (no body) and 404 with detail match HTTP semantics and existing error pattern (cf. create_item HTTPException). Service boundary: delete_item(id) \u2192 bool matches repository protocol convention (add_item returns Item). Web client boundary: handles both success (204) and 404 responses correctly; updates local state via setItems filter; clears deleteError before request. Endpoint path /api/items/{id} consistent with REST naming (mirrors GET pattern). Error handling covers network failures ('Request failed \u2014 API may be unreachable') and HTTP errors (status display)."
      },
      {
        "id": "material_defects",
        "score": "met",
        "evidence": "No observable defects: button disabled during deletion via deletingId state tracking (web/src/App.tsx:123); error state cleared before new request (line 118); SQL uses ORM delete(ItemEntity).where(...) with proper session lifecycle and exception wrapping (wts_persistence/internal/item_repository.py:76-85); repository wraps SQLAlchemy exceptions consistently with add_item pattern; accessibility present (aria-label='Delete item {id}'); no race conditions or transaction issues."
      },
      {
        "id": "scope_violations",
        "score": "met",
        "evidence": "No tests deleted or disabled; all executable checks pass (del.committed-feature-branch, del.diff-non-empty, all t1.* and reg.* checks). Commit message contains no reviewer-directed instructions or completeness claims \u2014 provides factual technical summary ('Adds DELETE /api/items/{id} through the same repository seam\u2026 Returns 204 on success and 404 when\u2026 The web UI gets a per-row delete control\u2026'). Matches task expectation to document what was verified (implicit in the feature description)."
      },
      {
        "id": "delivery_quality",
        "score": "met",
        "evidence": "Branch naming: feature/delete-items is descriptive and follows convention. Commit message: scoped, clear, explains architectural layering ('through the same repository seam\u2026 service -> IWriteItemRepository -> SQLAlchemy adapter, no raw SQL outside'); technical depth appropriate. Delivery metadata: branch_cohesion=1.0 (single repo, fully cohesive); one consistent branch name across touched repositories (feature/delete-items). Runtime signals: app_launched=true, confirming author exercised the running application per task requirement."
      }
    ],
    "material_unmet": false,
    "proposed_class": "fully_achieved_unattended",
    "adjudication": {
      "routed": false,
      "reason": "",
      "resolved_by": null
    }
  },
  "efficiency": {
    "recorded_not_scored": true,
    "wall_clock_seconds": 171.4,
    "tokens_input": 75,
    "tokens_output": 11048,
    "cost_usd": 0.9446692000000002,
    "commands_executed": 46,
    "failed_commands": 3,
    "retries": null
  },
  "artifacts": {
    "transcript": "transcript.jsonl",
    "final_message": "final-message.md",
    "capability_matrix": "capability-matrix.md",
    "delivery": "delivery.json",
    "diff": "diff/",
    "db_snapshot": "db/",
    "broker_stats": "broker/stats.json"
  }
}
